{"schemaVersion":"1.0","sessionId":"session-001","taskContractId":"phase-4-1-agent-session","invocations":[{"invocationId":"inv-001","sequence":0,"attempt":1,"traceId":"trace-001","obligationIds":["obl-1"],"startedAt":"2026-01-01T00:00:00Z","endedAt":"2026-01-01T00:01:00Z"},{"invocationId":"inv-002","sequence":1,"attempt":2,"traceId":"trace-002","obligationIds":["obl-1"],"startedAt":"2026-01-01T00:02:00Z","endedAt":"2026-01-01T00:03:00Z"}]}
