{"schemaVersion":"1.0","sessionId":"budget-session","taskContractId":"budget-task","invocations":[{"invocationId":"invoke-1","sequence":0,"attempt":1,"traceId":"budget-trace","obligationIds":["o1","o2"],"startedAt":"2026-01-01T00:00:00.0004000Z","endedAt":"2026-01-01T00:00:01.0000000Z"},{"invocationId":"invoke-2","sequence":1,"attempt":1,"traceId":"budget-trace","obligationIds":["o1"],"startedAt":"2026-01-01T00:01:00.0004000Z","endedAt":"2026-01-01T00:01:01.0000000Z"}]}
