{"schemaVersion":"1.0","sessionId":"advisory-session","taskContractId":"advisory-task","invocations":[{"invocationId":"invoke-1","sequence":1,"attempt":1,"traceId":"advisory-trace","obligationIds":["o1","o2"],"startedAt":"2026-01-01T00:00:00Z","endedAt":"2026-01-01T00:01:00Z"},{"invocationId":"invoke-2","sequence":2,"attempt":2,"traceId":"advisory-trace","obligationIds":["o1","o2"],"startedAt":"2026-01-01T00:02:00Z","endedAt":"2026-01-01T00:03:00Z"}]}
